{
  "$schema":"https://json-schema.org/draft/2020-12/schema",
  "$id":"custodial-v43-private-evidence-plane-contract-v1",
  "type":"object","additionalProperties":false,
  "required":["protocol","status","authority","scope","locator_registration","canonicalization","package_attestation","evidence_set","authorization_chain","decision_history","record_contracts","inherited_reference"],
  "properties":{"protocol":{"const":"CUSTODIAL_V43_PRIVATE_EVIDENCE_PLANE_CONTRACT_V1"},"status":{"const":"UNREGISTERED_NON_ACTIVATABLE"},"authority":{"$ref":"#/$defs/authority"},"scope":{"$ref":"#/$defs/scope"},"locator_registration":{"$ref":"#/$defs/locator_registration"},"canonicalization":{"$ref":"#/$defs/canonicalization"},"package_attestation":{"$ref":"#/$defs/attestation"},"evidence_set":{"$ref":"#/$defs/evidence_set"},"authorization_chain":{"$ref":"#/$defs/authorization_chain"},"decision_history":{"$ref":"#/$defs/decision_history"},"record_contracts":{"$ref":"#/$defs/record_contracts"},"inherited_reference":{"$ref":"#/$defs/inherited_reference"}},
  "$defs": {
    "id":{"type":"string","minLength":1,"pattern":"^[A-Za-z0-9][A-Za-z0-9._:-]*$"},"sha256":{"type":"string","pattern":"^[0-9a-f]{64}$"},"git_sha1":{"type":"string","pattern":"^[0-9a-f]{40}$"},"utc":{"type":"string","format":"date-time"},"string_list":{"type":"array","minItems":1,"uniqueItems":true,"items":{"type":"string","minLength":1}},
    "record_contracts":{"type":"object","additionalProperties":false,"required":["locator_registration","authorization_chain","authorization_decision","evidence_member","evidence_set","package_attestation","sequence_namespace_policy","namespace_entry","decision_common","stage_decision","gate_decision","invalidation","supersession"],"properties":{"locator_registration":{"$ref":"#/$defs/string_list"},"authorization_chain":{"$ref":"#/$defs/string_list"},"authorization_decision":{"$ref":"#/$defs/string_list"},"evidence_member":{"$ref":"#/$defs/string_list"},"evidence_set":{"$ref":"#/$defs/string_list"},"package_attestation":{"$ref":"#/$defs/string_list"},"sequence_namespace_policy":{"$ref":"#/$defs/string_list"},"namespace_entry":{"$ref":"#/$defs/string_list"},"decision_common":{"$ref":"#/$defs/string_list"},"stage_decision":{"$ref":"#/$defs/string_list"},"gate_decision":{"$ref":"#/$defs/string_list"},"invalidation":{"$ref":"#/$defs/string_list"},"supersession":{"$ref":"#/$defs/string_list"}}},
    "authority":{"type":"object","additionalProperties":false,"required":["activation_authorized","canonical_locator_registered","package_attestation_admissible","evidence_set_admissible","stage_decision_admissible","gate_decision_admissible","g_evidence_001_closure_authorized"],"properties":{"activation_authorized":{"const":false},"canonical_locator_registered":{"const":false},"package_attestation_admissible":{"const":false},"evidence_set_admissible":{"const":false},"stage_decision_admissible":{"const":false},"gate_decision_admissible":{"const":false},"g_evidence_001_closure_authorized":{"const":false}}},
    "scope":{"type":"object","additionalProperties":false,"required":["package_id","content_manifest_path","stage_control_model_path","gate_registry_path","root_gate"],"properties":{"package_id":{"const":"custodial-v43-private-evidence-plane-binding-v1"},"content_manifest_path":{"type":"string","minLength":1},"stage_control_model_path":{"type":"string","minLength":1},"gate_registry_path":{"type":"string","minLength":1},"root_gate":{"const":"G-EVIDENCE-001"}}},
    "locator_registration":{"type":"object","additionalProperties":false,"required":["status","actual_locator","required","allowed_locator_kinds","forbidden_public_reference_content"],"properties":{"status":{"const":"MISSING_PRIMARY_EVIDENCE"},"actual_locator":{"const":null},"required":{"$ref":"#/$defs/string_list"},"allowed_locator_kinds":{"$ref":"#/$defs/string_list"},"forbidden_public_reference_content":{"$ref":"#/$defs/string_list"}}},
    "canonicalization":{"type":"object","additionalProperties":false,"required":["encoding","string_normalization","object_key_order","whitespace","digest_algorithm","digest_framing","evidence_member_order","attestation_member_order"],"properties":{"encoding":{"const":"UTF-8"},"string_normalization":{"const":"Unicode NFC"},"object_key_order":{"const":"Unicode scalar ascending"},"whitespace":{"const":"none outside JSON strings"},"digest_algorithm":{"const":"SHA-256"},"digest_framing":{"const":"domain UTF-8 bytes, NUL, canonical UTF-8 bytes"},"evidence_member_order":{"const":"member_id ascending Unicode scalar"},"attestation_member_order":{"const":"manifest-relative path ascending Unicode scalar"}}},
    "attestation":{"type":"object","additionalProperties":false,"required":["status","required","invalidation"],"properties":{"status":{"const":"MISSING_PRIMARY_EVIDENCE"},"required":{"$ref":"#/$defs/string_list"},"invalidation":{"type":"string","minLength":1}}},"evidence_set":{"type":"object","additionalProperties":false,"required":["status","required","invalidation"],"properties":{"status":{"const":"MISSING_PRIMARY_EVIDENCE"},"required":{"$ref":"#/$defs/string_list"},"invalidation":{"type":"string","minLength":1}}},
    "authorization_chain":{"type":"object","additionalProperties":false,"required":["status","required","required_capability","phase1_stage_authority_substitution"],"properties":{"status":{"const":"MISSING_PRIMARY_EVIDENCE"},"required":{"$ref":"#/$defs/string_list"},"required_capability":{"const":"gate.g_evidence_001.decide"},"phase1_stage_authority_substitution":{"const":"forbidden"}}},
    "decision_history":{"type":"object","additionalProperties":false,"required":["status","sequence_namespace_policy","shared_or_separate_namespaces","required_common_fields","stage_required_fields","gate_required_fields","invalidation_and_supersession"],"properties":{"status":{"const":"MISSING_PRIMARY_EVIDENCE"},"sequence_namespace_policy":{"const":"UNRESOLVED_PRIMARY_EVIDENCE_REQUIRED"},"shared_or_separate_namespaces":{"const":"UNRESOLVED"},"required_common_fields":{"$ref":"#/$defs/string_list"},"stage_required_fields":{"$ref":"#/$defs/string_list"},"gate_required_fields":{"$ref":"#/$defs/string_list"},"invalidation_and_supersession":{"type":"string","minLength":1}}},
    "inherited_reference":{"type":"object","additionalProperties":false,"required":["value","classification","admissible_for_attestation","admissible_for_decision","admissible_for_gate_closure"],"properties":{"value":{"$ref":"#/$defs/sha256"},"classification":{"const":"UNVERIFIABLE_INHERITED_REFERENCE"},"admissible_for_attestation":{"const":false},"admissible_for_decision":{"const":false},"admissible_for_gate_closure":{"const":false}}},
    "private_safe_public_reference":{"type":"object","additionalProperties":false,"required":["reference_type","value"],"properties":{"reference_type":{"const":"sha256_locator"},"value":{"$ref":"#/$defs/sha256"}}},
    "candidate_locator_registration":{"type":"object","additionalProperties":false,"required":["registration_id","status","locator_kind","privacy_class","registrar_principal_id","registrar_authorization_decision_id","registration_digest_sha256","custody_assertion","retention_assertion","registered_at_utc","public_reference"],"properties":{"registration_id":{"$ref":"#/$defs/id"},"status":{"const":"CANDIDATE_ONLY"},"locator_kind":{"enum":["registered_private_repository","registered_private_archive","registered_private_service"]},"privacy_class":{"const":"PRIVATE_LOCATOR_REDACTED"},"registrar_principal_id":{"$ref":"#/$defs/id"},"registrar_authorization_decision_id":{"$ref":"#/$defs/id"},"registration_digest_sha256":{"$ref":"#/$defs/sha256"},"custody_assertion":{"type":"string","minLength":1},"retention_assertion":{"type":"string","minLength":1},"registered_at_utc":{"$ref":"#/$defs/utc"},"public_reference":{"$ref":"#/$defs/private_safe_public_reference"}}},
    "candidate_authorization_chain":{"type":"object","additionalProperties":false,"required":["chain_id","status","issuer_principal_id","credential_verification_reference","grant_id","tool_id","capability","resource_scope","authority_set_id","policy_version","revocation_reference","audit_retention_assertion","authorization_idempotency_key"],"properties":{"chain_id":{"$ref":"#/$defs/id"},"status":{"const":"CANDIDATE_ONLY"},"issuer_principal_id":{"$ref":"#/$defs/id"},"credential_verification_reference":{"$ref":"#/$defs/private_safe_public_reference"},"grant_id":{"$ref":"#/$defs/id"},"tool_id":{"$ref":"#/$defs/id"},"capability":{"const":"gate.g_evidence_001.decide"},"resource_scope":{"const":"G-EVIDENCE-001"},"authority_set_id":{"$ref":"#/$defs/id"},"policy_version":{"$ref":"#/$defs/id"},"revocation_reference":{"$ref":"#/$defs/private_safe_public_reference"},"audit_retention_assertion":{"type":"string","minLength":1},"authorization_idempotency_key":{"$ref":"#/$defs/id"}}},
    "authorization_decision":{"type":"object","additionalProperties":false,"required":["authorization_decision_id","principal_id","credential_reference","grant_id","capability","resource","authority_set_id","policy_version","decision","reason_code","decided_at_utc","idempotency_key"],"properties":{"authorization_decision_id":{"$ref":"#/$defs/id"},"principal_id":{"$ref":"#/$defs/id"},"credential_reference":{"$ref":"#/$defs/private_safe_public_reference"},"grant_id":{"$ref":"#/$defs/id"},"capability":{"const":"gate.g_evidence_001.decide"},"resource":{"const":"G-EVIDENCE-001"},"authority_set_id":{"$ref":"#/$defs/id"},"policy_version":{"$ref":"#/$defs/id"},"decision":{"const":"ALLOW"},"reason_code":{"$ref":"#/$defs/id"},"decided_at_utc":{"$ref":"#/$defs/utc"},"idempotency_key":{"$ref":"#/$defs/id"}}},
    "evidence_member":{"type":"object","additionalProperties":false,"required":["member_id","member_kind","public_reference","sensitivity","member_digest_sha256"],"properties":{"member_id":{"$ref":"#/$defs/id"},"member_kind":{"$ref":"#/$defs/id"},"public_reference":{"$ref":"#/$defs/private_safe_public_reference"},"sensitivity":{"$ref":"#/$defs/id"},"member_digest_sha256":{"$ref":"#/$defs/sha256"}}},
    "evidence_set_record":{"type":"object","additionalProperties":false,"required":["evidence_set_id","evidence_set_sha256","member_count","ordered_member_ids","member_identity_digest_sha256","canonicalization_id","issuer_principal_id","issuer_authorization_decision_id","created_at_utc","members"],"properties":{"evidence_set_id":{"$ref":"#/$defs/id"},"evidence_set_sha256":{"$ref":"#/$defs/sha256"},"member_count":{"type":"integer","minimum":1},"ordered_member_ids":{"$ref":"#/$defs/string_list"},"member_identity_digest_sha256":{"$ref":"#/$defs/sha256"},"canonicalization_id":{"const":"canonical-json.nfc.unicode-scalar.v1"},"issuer_principal_id":{"$ref":"#/$defs/id"},"issuer_authorization_decision_id":{"$ref":"#/$defs/id"},"created_at_utc":{"$ref":"#/$defs/utc"},"members":{"type":"array","minItems":1,"items":{"$ref":"#/$defs/evidence_member"}}}},
    "package_attestation_record":{"type":"object","additionalProperties":false,"required":["package_attestation_id","content_manifest_sha256","content_manifest_git_blob_sha1","repository_identity","exact_commit","exact_tree","member_sha256_set_digest","attestation_canonical_sha256","issuer_principal_id","issuer_authorization_decision_id","evidence_set_sha256","issued_at_utc"],"properties":{"package_attestation_id":{"$ref":"#/$defs/id"},"content_manifest_sha256":{"$ref":"#/$defs/sha256"},"content_manifest_git_blob_sha1":{"$ref":"#/$defs/git_sha1"},"repository_identity":{"const":"https://github.com/lasrevinu333-design/Engine.git"},"exact_commit":{"const":"ea22af22685d466b66334000c6bd931fb4beca6d"},"exact_tree":{"const":"61baa8d9499fcc8fb1a61c16361133ed9dddaae1"},"member_sha256_set_digest":{"const":"bc2c8adf2e7eb5ba67692d6bd357e3f52503bcb5d1a79a72280fe7d43df4838b"},"attestation_canonical_sha256":{"$ref":"#/$defs/sha256"},"issuer_principal_id":{"$ref":"#/$defs/id"},"issuer_authorization_decision_id":{"$ref":"#/$defs/id"},"evidence_set_sha256":{"$ref":"#/$defs/sha256"},"issued_at_utc":{"$ref":"#/$defs/utc"}}},
    "namespace_entry":{"type":"object","additionalProperties":false,"required":["namespace_id","record_family","start_sequence"],"properties":{"namespace_id":{"$ref":"#/$defs/id"},"record_family":{"enum":["stage","gate","invalidation","supersession"]},"start_sequence":{"const":1}}},
    "sequence_namespace_policy":{"type":"object","additionalProperties":false,"required":["policy_id","status","mode","cross_family_rule","namespaces"],"properties":{"policy_id":{"$ref":"#/$defs/id"},"status":{"const":"CANDIDATE_ONLY"},"mode":{"const":"SEPARATE"},"cross_family_rule":{"const":"FORBID_AMBIGUITY"},"namespaces":{"type":"array","minItems":4,"uniqueItems":true,"items":{"$ref":"#/$defs/namespace_entry"}}}},
    "decision_common":{"type":"object","additionalProperties":false,"required":["decision_id","record_family","aggregate_id","sequence_namespace_id","sequence","predecessor_record_sha256","idempotency_key","authorization_decision_id","package_attestation_id","evidence_set_sha256","record_sha256","decided_at_utc"],"properties":{"decision_id":{"$ref":"#/$defs/id"},"record_family":{"type":"string"},"aggregate_id":{"$ref":"#/$defs/id"},"sequence_namespace_id":{"$ref":"#/$defs/id"},"sequence":{"type":"integer","minimum":1},"predecessor_record_sha256":{"type":["string","null"],"pattern":"^[0-9a-f]{64}$"},"idempotency_key":{"$ref":"#/$defs/id"},"authorization_decision_id":{"$ref":"#/$defs/id"},"package_attestation_id":{"$ref":"#/$defs/id"},"evidence_set_sha256":{"$ref":"#/$defs/sha256"},"record_sha256":{"$ref":"#/$defs/sha256"},"decided_at_utc":{"$ref":"#/$defs/utc"}}},
    "stage_decision":{"type":"object","additionalProperties":false,"required":["decision_id","record_family","aggregate_id","sequence_namespace_id","sequence","predecessor_record_sha256","idempotency_key","authorization_decision_id","package_attestation_id","evidence_set_sha256","record_sha256","expected_prior_state","command","next_state","actor_principal_id","decided_at_utc"],"properties":{"decision_id":{"$ref":"#/$defs/id"},"record_family":{"const":"stage"},"aggregate_id":{"$ref":"#/$defs/id"},"sequence_namespace_id":{"$ref":"#/$defs/id"},"sequence":{"type":"integer","minimum":1},"predecessor_record_sha256":{"type":["string","null"],"pattern":"^[0-9a-f]{64}$"},"idempotency_key":{"$ref":"#/$defs/id"},"authorization_decision_id":{"$ref":"#/$defs/id"},"package_attestation_id":{"$ref":"#/$defs/id"},"evidence_set_sha256":{"$ref":"#/$defs/sha256"},"record_sha256":{"$ref":"#/$defs/sha256"},"expected_prior_state":{"$ref":"#/$defs/id"},"command":{"$ref":"#/$defs/id"},"next_state":{"$ref":"#/$defs/id"},"actor_principal_id":{"$ref":"#/$defs/id"},"decided_at_utc":{"$ref":"#/$defs/utc"}}},
    "gate_decision":{"type":"object","additionalProperties":false,"required":["decision_id","record_family","aggregate_id","sequence_namespace_id","sequence","predecessor_record_sha256","idempotency_key","authorization_decision_id","package_attestation_id","evidence_set_sha256","record_sha256","gate_id","expected_prior_status","command","next_status","decision_authority_principal","decided_at_utc"],"properties":{"decision_id":{"$ref":"#/$defs/id"},"record_family":{"const":"gate"},"aggregate_id":{"$ref":"#/$defs/id"},"sequence_namespace_id":{"$ref":"#/$defs/id"},"sequence":{"type":"integer","minimum":1},"predecessor_record_sha256":{"type":["string","null"],"pattern":"^[0-9a-f]{64}$"},"idempotency_key":{"$ref":"#/$defs/id"},"authorization_decision_id":{"$ref":"#/$defs/id"},"package_attestation_id":{"$ref":"#/$defs/id"},"evidence_set_sha256":{"$ref":"#/$defs/sha256"},"record_sha256":{"$ref":"#/$defs/sha256"},"gate_id":{"const":"G-EVIDENCE-001"},"expected_prior_status":{"$ref":"#/$defs/id"},"command":{"$ref":"#/$defs/id"},"next_status":{"$ref":"#/$defs/id"},"decision_authority_principal":{"$ref":"#/$defs/id"},"decided_at_utc":{"$ref":"#/$defs/utc"}}},
    "invalidation":{"type":"object","additionalProperties":false,"required":["invalidation_id","record_family","aggregate_id","sequence_namespace_id","sequence","predecessor_record_sha256","idempotency_key","authorization_decision_id","authorizer_principal_id","target_evidence_set_sha256","target_package_attestation_id","target_record_sha256","reason_code","recorded_at_utc","record_sha256"],"properties":{"invalidation_id":{"$ref":"#/$defs/id"},"record_family":{"const":"invalidation"},"aggregate_id":{"$ref":"#/$defs/id"},"sequence_namespace_id":{"$ref":"#/$defs/id"},"sequence":{"type":"integer","minimum":1},"predecessor_record_sha256":{"type":["string","null"],"pattern":"^[0-9a-f]{64}$"},"idempotency_key":{"$ref":"#/$defs/id"},"authorization_decision_id":{"$ref":"#/$defs/id"},"authorizer_principal_id":{"$ref":"#/$defs/id"},"target_evidence_set_sha256":{"$ref":"#/$defs/sha256"},"target_package_attestation_id":{"$ref":"#/$defs/id"},"target_record_sha256":{"$ref":"#/$defs/sha256"},"reason_code":{"$ref":"#/$defs/id"},"recorded_at_utc":{"$ref":"#/$defs/utc"},"record_sha256":{"$ref":"#/$defs/sha256"}}},
    "supersession":{"type":"object","additionalProperties":false,"required":["supersession_id","record_family","aggregate_id","sequence_namespace_id","sequence","predecessor_record_sha256","idempotency_key","authorization_decision_id","authorizer_principal_id","superseded_evidence_set_sha256","successor_evidence_set_sha256","superseded_package_attestation_id","successor_package_attestation_id","superseded_record_sha256","successor_record_sha256","reason_code","recorded_at_utc","record_sha256"],"properties":{"supersession_id":{"$ref":"#/$defs/id"},"record_family":{"const":"supersession"},"aggregate_id":{"$ref":"#/$defs/id"},"sequence_namespace_id":{"$ref":"#/$defs/id"},"sequence":{"type":"integer","minimum":1},"predecessor_record_sha256":{"type":["string","null"],"pattern":"^[0-9a-f]{64}$"},"idempotency_key":{"$ref":"#/$defs/id"},"authorization_decision_id":{"$ref":"#/$defs/id"},"authorizer_principal_id":{"$ref":"#/$defs/id"},"superseded_evidence_set_sha256":{"$ref":"#/$defs/sha256"},"successor_evidence_set_sha256":{"$ref":"#/$defs/sha256"},"superseded_package_attestation_id":{"$ref":"#/$defs/id"},"successor_package_attestation_id":{"$ref":"#/$defs/id"},"superseded_record_sha256":{"$ref":"#/$defs/sha256"},"successor_record_sha256":{"$ref":"#/$defs/sha256"},"reason_code":{"$ref":"#/$defs/id"},"recorded_at_utc":{"$ref":"#/$defs/utc"},"record_sha256":{"$ref":"#/$defs/sha256"}}}
  }
}
